{
  "meta": {
    "schemaVersion": "1.0.0",
    "datasetVersion": "2026.04.02",
    "source": "Consolidação validada dos dados estruturados do PublicWebsite.",
    "sourceDocuments": [
      "dados-publicwebsite.json"
    ],
    "createdAt": "2026-04-02T12:00:00Z",
    "updatedAt": "2026-04-02T12:00:00Z",
    "totalOrixas": 15,
    "totalGuias": 8,
    "totalLinhas": 7,
    "totalOracoes": 4
  },
  "orixas": [
    {
      "id": 1,
      "slug": "oxala",
      "name": "Oxalá",
      "description": "Oxalá tem origem na tradição Yorubá da África, onde é conhecido como Obatalá.",
      "origin": "Oxalá tem origem na tradição Yorubá da África, onde é conhecido como Obatalá. É considerado o criador da humanidade e o pai de todos os Orixás.",
      "batuaraTeaching": "Na Casa Batuara, Oxalá é reverenciado como o grande pai, aquele que nos ensina a humildade, a paciência e o amor incondicional. Seus ensinamentos nos mostram que através da paz interior e da pureza de coração podemos alcançar a elevação espiritual.",
      "displayOrder": 1,
      "characteristics": [
        "Paciência",
        "Sabedoria",
        "Pureza",
        "Paz",
        "Criação",
        "Paternidade",
        "Humildade",
        "Amor incondicional"
      ],
      "colors": [
        "Branco",
        "Azul claro"
      ],
      "elements": [
        "Ar",
        "Éter",
        "Luz"
      ],
      "element": "Ar",
      "habitat": "Campo aberto / planície",
      "atuacao": "Espiritualidade",
      "saudacao": "Epa babá",
      "simbolo": "Pomba Branca",
      "cor": "Branco",
      "diaSemana": "Sexta",
      "fruta": "Uva Branca",
      "comida": "Canjica",
      "bebida": "Champagne Branca",
      "dataComemoracao": "Não especificada",
      "isActive": true,
      "source": {
        "status": "validated",
        "primarySource": "dados-publicwebsite.json",
        "pages": [
          1,
          2,
          3
        ],
        "notes": "Registro validado a partir do arquivo estruturado consolidado do portal.",
        "updatedAt": "2026-04-02T12:00:00Z"
      },
      "createdAt": "2026-04-02T12:00:00Z",
      "updatedAt": "2026-04-02T12:00:00Z"
    },
    {
      "id": 2,
      "slug": "iemanja",
      "name": "Iemanjá",
      "description": "Iemanjá tem origem na tradição Yorubá, onde é conhecida como Yemoja.",
      "origin": "Iemanjá tem origem na tradição Yorubá, onde é conhecida como Yemoja. É a divindade dos rios e mares, mãe de muitos Orixás e protetora das mulheres e crianças.",
      "batuaraTeaching": "A Casa Batuara tem especial devoção à Iemanjá, nossa mãe querida. Ela nos ensina o amor incondicional de mãe, a proteção aos necessitados e a importância da família espiritual.",
      "displayOrder": 2,
      "characteristics": [
        "Maternidade",
        "Proteção",
        "Fertilidade",
        "Amor maternal",
        "Cura",
        "Acolhimento",
        "Generosidade",
        "Compaixão"
      ],
      "colors": [
        "Azul",
        "Branco",
        "Azul marinho",
        "Prata"
      ],
      "elements": [
        "Água",
        "Mar",
        "Rios",
        "Conchas"
      ],
      "element": "Água",
      "habitat": "Mar - Praia",
      "atuacao": "Família",
      "saudacao": "Odocya",
      "simbolo": "Pérola ou estrela do Mar",
      "cor": "Azul",
      "diaSemana": "Sábado",
      "fruta": "Mamão Papaya",
      "comida": "Peixe",
      "bebida": "Champagne Branca",
      "dataComemoracao": "23 de Abril / 02 de Fevereiro",
      "isActive": true,
      "source": {
        "status": "validated",
        "primarySource": "dados-publicwebsite.json",
        "pages": [
          1,
          2,
          3
        ],
        "notes": "Registro validado a partir do arquivo estruturado consolidado do portal.",
        "updatedAt": "2026-04-02T12:00:00Z"
      },
      "createdAt": "2026-04-02T12:00:00Z",
      "updatedAt": "2026-04-02T12:00:00Z"
    },
    {
      "id": 3,
      "slug": "nana",
      "name": "Nanã",
      "description": "Nanã é uma das mais antigas Orixás femininas, conhecida como senhora da sabedoria ancestral e dos mistérios da vida e morte.",
      "origin": "Nanã é uma das mais antigas Orixás femininas, conhecida como senhora da sabedoria ancestral e dos mistérios da vida e morte.",
      "batuaraTeaching": "Na Casa Batuara, Nanã é reverenciada como a anciã sábia, aquela que guarda os segredos da vida e da morte, ensinando-nos a respeitar todos os ciclos da existência.",
      "displayOrder": 3,
      "characteristics": [
        "Sabedoria",
        "Tradição",
        "Paciência",
        "Mistério",
        "Respeito aos antepassados"
      ],
      "colors": [
        "Lilás",
        "Roxo"
      ],
      "elements": [
        "Água",
        "Lama",
        "Terra"
      ],
      "element": "Água",
      "habitat": "Areia molhada da praia (cavar)",
      "atuacao": "Emoções",
      "saudacao": "Salupa Nanã",
      "simbolo": "Vassoura de palha da Costa",
      "cor": "Lilás",
      "diaSemana": "Sábado",
      "fruta": "Romã",
      "comida": "Água Salgada Casquinha Siri",
      "bebida": "Champagne Branca",
      "dataComemoracao": "15 de Agosto",
      "isActive": true,
      "source": {
        "status": "validated",
        "primarySource": "dados-publicwebsite.json",
        "pages": [
          1,
          2,
          3
        ],
        "notes": "Registro validado a partir do arquivo estruturado consolidado do portal.",
        "updatedAt": "2026-04-02T12:00:00Z"
      },
      "createdAt": "2026-04-02T12:00:00Z",
      "updatedAt": "2026-04-02T12:00:00Z"
    },
    {
      "id": 4,
      "slug": "oxum",
      "name": "Oxum",
      "description": "Oxum é a Orixá das águas doces, dos rios e cachoeiras, conhecida como a senhora do ouro e do amor.",
      "origin": "Oxum é a Orixá das águas doces, dos rios e cachoeiras, conhecida como a senhora do ouro e do amor.",
      "batuaraTeaching": "Na Casa Batuara, Oxum é muito querida por suas qualidades de amor, beleza e fertilidade. Ela nos ensina a valorizar a doçura da vida e a beleza interior.",
      "displayOrder": 4,
      "characteristics": [
        "Amor",
        "Beleza",
        "Fertilidade",
        "Doçura",
        "Prosperidade"
      ],
      "colors": [
        "Dourado",
        "Amarelo"
      ],
      "elements": [
        "Água doce",
        "Ouro",
        "Rios"
      ],
      "element": "Água",
      "habitat": "Rio",
      "atuacao": "Amor – Fertilidade",
      "saudacao": "Aiê iê ô",
      "simbolo": "Ouro",
      "cor": "Dourado",
      "diaSemana": "Sábado",
      "fruta": "Melão",
      "comida": "Peixe água doce",
      "bebida": "Champagne Branca",
      "dataComemoracao": "16 de Agosto",
      "isActive": true,
      "source": {
        "status": "validated",
        "primarySource": "dados-publicwebsite.json",
        "pages": [
          1,
          2,
          3
        ],
        "notes": "Registro validado a partir do arquivo estruturado consolidado do portal.",
        "updatedAt": "2026-04-02T12:00:00Z"
      },
      "createdAt": "2026-04-02T12:00:00Z",
      "updatedAt": "2026-04-02T12:00:00Z"
    },
    {
      "id": 5,
      "slug": "ogum",
      "name": "Ogum",
      "description": "Ogum é uma das divindades mais antigas da tradição Yorubá, conhecido como o senhor do ferro e da guerra.",
      "origin": "Ogum é uma das divindades mais antigas da tradição Yorubá, conhecido como o senhor do ferro e da guerra.",
      "batuaraTeaching": "A Casa Batuara ensina que Ogum é o grande trabalhador, aquele que nos mostra a importância do esforço e da dedicação para alcançar nossos objetivos.",
      "displayOrder": 5,
      "characteristics": [
        "Trabalho",
        "Perseverança",
        "Coragem",
        "Determinação",
        "Proteção",
        "Liderança",
        "Honestidade",
        "Força de vontade"
      ],
      "colors": [
        "Azul escuro",
        "Vermelho",
        "Verde escuro"
      ],
      "elements": [
        "Ferro",
        "Metal",
        "Terra",
        "Fogo"
      ],
      "element": "Fogo",
      "habitat": "Estrada",
      "atuacao": "Batalha",
      "saudacao": "Ogunhê",
      "simbolo": "Espada de aço",
      "cor": "Vermelho",
      "diaSemana": "Quinta",
      "fruta": "Lima da Pérsia",
      "comida": "Feijoada",
      "bebida": "Cerveja",
      "dataComemoracao": "20 de Janeiro / 27 de Julho",
      "isActive": true,
      "source": {
        "status": "validated",
        "primarySource": "dados-publicwebsite.json",
        "pages": [
          1,
          2,
          3
        ],
        "notes": "Registro validado a partir do arquivo estruturado consolidado do portal.",
        "updatedAt": "2026-04-02T12:00:00Z"
      },
      "createdAt": "2026-04-02T12:00:00Z",
      "updatedAt": "2026-04-02T12:00:00Z"
    },
    {
      "id": 6,
      "slug": "oxossi",
      "name": "Oxóssi",
      "description": "Oxóssi é o Orixá caçador, senhor das matas e da fartura, conhecido por sua sabedoria e conexão com a natureza.",
      "origin": "Oxóssi é o Orixá caçador, senhor das matas e da fartura, conhecido por sua sabedoria e conexão com a natureza.",
      "batuaraTeaching": "Na Casa Batuara, Oxóssi é reverenciado como o provedor, aquele que nos ensina a buscar o conhecimento e a viver em harmonia com a natureza.",
      "displayOrder": 6,
      "characteristics": [
        "Sabedoria",
        "Conhecimento",
        "Prosperidade",
        "Caça",
        "Natureza",
        "Fartura"
      ],
      "colors": [
        "Verde",
        "Azul"
      ],
      "elements": [
        "Mata",
        "Terra",
        "Arco"
      ],
      "element": "Terra",
      "habitat": "Mata",
      "atuacao": "Prosperidade/fartura",
      "saudacao": "Oxossi ê",
      "simbolo": "Arco e flecha",
      "cor": "Verde",
      "diaSemana": "Terça",
      "fruta": "Goiaba",
      "comida": "Caça",
      "bebida": "Cerveja",